id,title,summary,link,image
l,2 reasons why a record $1.39B is expected to be bet on the Super Bowl," By Chandelis Duster A man gambles in a casino ahead of last year's Super Bowl, on Feb. 8, 2024, in Las Vegas.Jamie Squire/Getty Imageshide caption As Americans prepare to watch the most highly antici...",https://www.npr.org/2025/02/08/nx-s1-5290099/one-billion-super-bowl-lix-bets,['https://npr.brightspotcdn.com/dims3/default/strip/false/crop/5652x3179+0+294/resize/500/quality/85/format/webp/?url=http%3A%2F%2Fnpr-brightspot.s3.amazonaws.com%2Fe4%2F36%2F5b7325db4cf49d9d6ec456ade235%2Fap25036450448580.jpg']
r,Bret Baier and President Trump to go one-on-one in Super Bowl interview," This material may not be published, broadcast, rewritten,
      or redistributed. ©2025 FOX News Network, LLC. All rights reserved.
      Quotes displayed in real-time or delayed by at least 15 minut...",https://www.foxnews.com/media/fox-news-bret-baier-interview-president-donald-trump-during-super-bowl-pre-game-show,['https://i.abcnewsfe.com/a/a0a2cac8-2a1c-41d3-8100-9e12928d64de/alaska-plane-ht-jt-250207_1738970715388_hpMain_16x9.jpg?w=1170']
m,Brittany Mahomes takes kids to aquarium in New Orleans ahead of Super Bowl," ""First adventure of NOLA."" Brittany Mahomes is making the most of her time in New Orleans ahead of Super Bowl LIX on Sunday. The wife of Kansas City Chiefs quarterback Patrick Mahomes took toInstagra...",https://abcnews.go.com/GMA/Culture/brittany-mahomes-takes-kids-aquarium-new-orleans-ahead/story?id=118602520,['https://npr.brightspotcdn.com/dims3/default/strip/false/crop/5652x3179+0+294/resize/500/quality/85/format/webp/?url=http%3A%2F%2Fnpr-brightspot.s3.amazonaws.com%2Fe4%2F36%2F5b7325db4cf49d9d6ec456ade235%2Fap25036450448580.jpg']
