id,title,summary,link,image
1,2 reasons why a record $1.39B is expected to be bet on the Super Bowl," By Chandelis Duster A man gambles in a casino ahead of last year's Super Bowl, on Feb. 8, 2024, in Las Vegas.Jamie Squire/Getty Imageshide caption As Americans prepare to watch the most highly antici...",https://www.npr.org/2025/02/08/nx-s1-5290099/one-billion-super-bowl-lix-bets,https://a57.foxnews.com/static.foxnews.com/foxnews.com/content/uploads/2024/11/646/364/trump-trudeau.jpg?tl=1&ve=1
3,Bret Baier and President Trump to go one-on-one in Super Bowl interview," This material may not be published, broadcast, rewritten,
      or redistributed. ©2025 FOX News Network, LLC. All rights reserved.
      Quotes displayed in real-time or delayed by at least 15 minut...",https://www.foxnews.com/media/fox-news-bret-baier-interview-president-donald-trump-during-super-bowl-pre-game-show,https://i.abcnewsfe.com/a/e548bf47-ba35-4cb9-8026-acd339140af4/passport-gty-er-250207_1738972486546_hpMain_16x9.jpg?w=1170
2,The best outdoor TVs to entertain in any environment just in time for the Super Bowl," The IP rating system determines a product's ability to withstand elements. Outdoor entertainment can be a transformative addition to a patio, porch, or yard to turn the space from acasual lounge envi...",https://abcnews.go.com/Shop/best-outdoor-televisions/story?id=108799317,https://i.abcnewsfe.com/a/cd725bca-156d-40b5-89f5-37898ea0446c/hostage-release-celebration_1739010711484_hpMain_16x9.jpg?w=1170
